{"module_id":"M12","artifact_commit":"m12revise5d4e6f7","baseline_tag":"m12-revise-baseline","evaluated_at":"2026-08-04T09:45:08-07:00","structural_gates":[{"id":"G01","passed":false,"evidence":["modules/12-reliability-incidents-disaster-recovery/assessment/calibration/revise.md#Submission identity: A01\u2013A11 resolve, chronology and assistance disclosure are present, but two implementation-review headings and one defense citation omit exact commits."]},{"id":"G02","passed":true,"evidence":["modules/12-reliability-incidents-disaster-recovery/assessment/calibration/revise.md#Submission identity: The fixture explicitly states that chronology is intact."]},{"id":"G03","passed":true,"evidence":["modules/12-reliability-incidents-disaster-recovery/assessment/calibration/revise.md#Build and bounded degradation: The build and tests resolve, priority work is bounded, and repaired invariants pass."]},{"id":"G04","passed":true,"evidence":["modules/12-reliability-incidents-disaster-recovery/assessment/calibration/revise.md#Recovery pairs: All pairs share inputs, change one control, preserve repaired I01\u2013I12 behavior, and have recalculating RPO results."]},{"id":"G05","passed":true,"evidence":["modules/12-reliability-incidents-disaster-recovery/assessment/calibration/revise.md#Decision and Gate 4: All Gate 4 parts exist and safety holds; the remaining decision gaps are explicitly described as remediable."]},{"id":"G06","passed":false,"evidence":["modules/12-reliability-incidents-disaster-recovery/assessment/calibration/revise.md#Decision and Gate 4: Recovery staffing is absent from cost analysis and one dissent lacks an owner or resolution evidence.","modules/12-reliability-incidents-disaster-recovery/assessment/calibration/revise.md#Recovery-tier and degradation ADR: A12 is distinct and consistent with DR evidence but lacks degradation-exception expiry and a quantified reversal observation window."]}],"rubric_scores":[{"criterion_id":"R01","score":2,"evidence":["modules/12-reliability-incidents-disaster-recovery/assessment/calibration/revise.md#Journey, budget, and alerts: Journeys are correct, but the publication coverage rule does not define treatment of missing end events."],"findings":["missing_evidence: The publication SLI lacks an explicit rule for missing end events, leaving population coverage incomplete."],"remediation":["Revisit published Module 12 Lesson 1 and complete EX-01\u2013EX-02 to produce a dated population and objective addendum without changing frozen evidence."]},{"criterion_id":"R02","score":2,"evidence":["modules/12-reliability-incidents-disaster-recovery/assessment/calibration/revise.md#Journey, budget, and alerts: Budget and burn arithmetic are valid, but one dependency correlation is estimated without sensitivity evidence."],"findings":["unsupported_claim: A dependency correlation remains an estimate without a sensitivity analysis supporting its decision consequences."],"remediation":["Revisit published Module 12 Lesson 2 and complete EX-03\u2013EX-05 to add a recalculated dependency-sensitivity model."]},{"criterion_id":"R03","score":2,"evidence":["modules/12-reliability-incidents-disaster-recovery/assessment/calibration/revise.md#Journey, budget, and alerts: Burn arithmetic is valid, but the low-traffic alert rule has no reset test."],"findings":["missing_evidence: The low-traffic alert policy lacks a reset test demonstrating that alert state clears correctly."],"remediation":["Revisit published Module 12 Lesson 3 and complete EX-06\u2013EX-07 to add a new synthetic time-series reset test."]},{"criterion_id":"R04","score":2,"evidence":["modules/12-reliability-incidents-disaster-recovery/assessment/calibration/revise.md#Build and bounded degradation: Priority work is bounded and repaired invariants pass, but regional reserve excludes telemetry and warm-up overhead."],"findings":["unsupported_claim: The RTO capacity claim is not supported by a reserve calculation that includes telemetry and warm-up overhead."],"remediation":["Revisit published Module 12 Lesson 4 and complete EX-08\u2013EX-09 to add a new load or failure-domain pair with capacity sensitivity evidence."]},{"criterion_id":"R05","score":2,"evidence":["modules/12-reliability-incidents-disaster-recovery/assessment/calibration/revise.md#Incident and postmortem: Roles, serialized changes, timeline, and mitigation resolve, but one stakeholder update lacks a next-update time."],"findings":["communication_gap: One stakeholder communication omits the next-update time required for a complete incident cadence."],"remediation":["Revisit published Module 12 Lesson 5 and complete EX-10\u2013EX-11 to produce a new controlled communication-handoff exercise."]},{"criterion_id":"R06","score":2,"evidence":["modules/12-reliability-incidents-disaster-recovery/assessment/calibration/revise.md#Incident and postmortem: Two owned corrective actions lack verification dates, and the causal alternative table cites symptoms instead of a discriminating rerun."],"findings":["missing_evidence: Two corrective actions have no verification dates.","incorrect_reasoning: The causal-alternative analysis uses symptoms rather than evidence from a discriminating rerun."],"remediation":["Revisit published Module 12 Lesson 6 and complete EX-12\u2013EX-13 to add a dated causal and corrective-action verification review."]},{"criterion_id":"R07","score":3,"evidence":["modules/12-reliability-incidents-disaster-recovery/assessment/calibration/revise.md#Recovery pairs: Paired recovery inputs are controlled, repaired invariants pass, and RPO calculations recalculate."],"findings":["communication_gap: Break-glass expiry evidence is cited imprecisely, weakening traceability around recovery access constraints."],"remediation":["Revisit published Module 12 Lesson 7 and complete EX-14 to add precisely cited isolated-restore and recovery-access evidence."]},{"criterion_id":"R08","score":2,"evidence":["modules/12-reliability-incidents-disaster-recovery/assessment/calibration/revise.md#Recovery pairs: The failback observation window is asserted rather than connected to peak workload.","modules/12-reliability-incidents-disaster-recovery/assessment/calibration/revise.md#Build and bounded degradation: The regional RTO capacity calculation omits telemetry and warm-up overhead."],"findings":["unsupported_claim: The failback observation window is not supported by peak-workload evidence.","unsupported_claim: The regional RTO capacity conclusion lacks overhead sensitivity for telemetry and warm-up."],"remediation":["Revisit published Module 12 Lesson 7 and complete EX-15 to add a new regional recovery pair covering peak workload and capacity sensitivity."]},{"criterion_id":"R09","score":3,"evidence":["modules/12-reliability-incidents-disaster-recovery/assessment/calibration/revise.md#Recovery pairs: Every pair shares inputs, changes one control, and repairs I01\u2013I12.","modules/12-reliability-incidents-disaster-recovery/assessment/calibration/revise.md#Submission identity: Raw evidence is unchanged and assistance is disclosed, although several commit citations are incomplete."],"findings":["missing_evidence: Exact commit provenance is absent from two implementation-review headings and one defense citation.","communication_gap: Break-glass expiry evidence is cited imprecisely despite repaired invariants and controlled pairs."],"remediation":["Revisit published Module 12 Lesson 8 and complete EX-16 to add a newly authorized game-day seed with exact provenance and safety citations."]},{"criterion_id":"R10","score":2,"evidence":["modules/12-reliability-incidents-disaster-recovery/assessment/calibration/revise.md#Decision and Gate 4: Three tiers are compared and Gate 4 safety holds, but recovery staffing cost and dissent resolution are incomplete.","modules/12-reliability-incidents-disaster-recovery/assessment/calibration/revise.md#Recovery-tier and degradation ADR: A12 is distinct with owners and rollback, but exception expiry and a quantified reversal window are missing."],"findings":["missing_evidence: Tier cost does not include recovery staffing.","missing_evidence: One dissent has neither an owner nor resolution evidence.","missing_evidence: A12 lacks degradation-exception expiry and a quantified reversal observation window."],"remediation":["Revisit published Module 12 Lesson 8 and complete EX-16 to submit a follow-up defense and dated A12 revision addendum while preserving frozen evidence."]}],"average_score":2.2,"safety_critical_zero":false,"result":"Revise","confidence":{"level":"medium","reasons":["The fixture directly states that chronology, paired-input control, repaired invariants, RPO recalculation, and Gate 4 safety hold.","The fixture is a condensed calibration artifact rather than raw trial evidence, so level-4 claims and several complete level-3 anchors cannot be independently verified.","G01 and G06 gaps are explicit and remediable; G02\u2013G05 pass and no safety-critical criterion scores zero."]},"summary":"Revise. Hard gates G02\u2013G05 pass and no safety-critical rubric is zero, but incomplete provenance causes G01 to fail and decision/ADR omissions cause G06 to fail. The 2.20 average reflects material but remediable traceability, sensitivity, alert-reset, communication, causal-verification, failback, capacity, cost, dissent, and reversal-window gaps.","next_actions":["Preserve the frozen submission and add dated provenance addenda resolving the missing implementation-review and defense commit citations.","Add new evidence for missing-event handling, dependency sensitivity, low-traffic alert reset, regional overhead capacity, corrective-action verification, peak-workload failback, and precise break-glass expiry traceability.","Complete the DR and A12 addenda with recovery staffing cost, owned dissent resolution, degradation-exception expiry, and a quantified reversal observation window."]}
