{"module_id":"M11","artifact_commit":"m11-repeat-9a8b7c6","baseline_tag":null,"evaluated_at":"2026-08-02T14:25:00-07:00","structural_gates":[{"id":"G01","passed":false,"evidence":["modules/11-messaging-streams-workflows/assessment/calibration/repeat.md#submission-identity: Baseline, hashes, and disclosure are absent."]},{"id":"G02","passed":false,"evidence":["modules/11-messaging-streams-workflows/assessment/calibration/repeat.md#submission-identity: Raw outputs changed and no frozen prediction exists."]},{"id":"G03","passed":false,"evidence":["modules/11-messaging-streams-workflows/assessment/calibration/repeat.md#build-and-evidence: Atomic and idempotent interfaces are unsafe or absent."]},{"id":"G04","passed":false,"evidence":["modules/11-messaging-streams-workflows/assessment/calibration/repeat.md#failure-pairs: No valid paired evidence or arithmetic exists."]},{"id":"G05","passed":false,"evidence":["modules/11-messaging-streams-workflows/assessment/calibration/repeat.md#workflow-and-recovery: Repaired safety and recovery fail."]},{"id":"G06","passed":false,"evidence":["modules/11-messaging-streams-workflows/assessment/calibration/repeat.md#decision-and-defense: Decision, ownership, and migration evidence are absent."]}],"rubric_scores":[{"criterion_id":"R01","score":0,"evidence":["modules/11-messaging-streams-workflows/assessment/calibration/repeat.md#authority-and-semantics: Dual write creates conflicting publication authority."],"findings":["incorrect_reasoning: Database and broker are treated as one atomic authority."],"remediation":["Revisit Lesson 1 and EX-01–EX-02; create a new authority baseline."]},{"criterion_id":"R02","score":0,"evidence":["modules/11-messaging-streams-workflows/assessment/calibration/repeat.md#authority-and-semantics: Retry identities change and exactly-once scope is false."],"findings":["invariant_failure: Duplicate attempts cannot converge under changing identities."],"remediation":["Revisit Lesson 2 and EX-03–EX-04; run a new crash schedule."]},{"criterion_id":"R03","score":1,"evidence":["modules/11-messaging-streams-workflows/assessment/calibration/repeat.md#failure-pairs: Ordering and partition evidence are absent."],"findings":["missing_evidence: No key, version, skew, or consumer-group contract exists."],"remediation":["Revisit Lesson 3 and EX-05–EX-06; produce a new partition analysis."]},{"criterion_id":"R04","score":0,"evidence":["modules/11-messaging-streams-workflows/assessment/calibration/repeat.md#build-and-evidence: Offset advances early and bulletin is duplicated."],"findings":["invariant_failure: Accepted work can be lost and an irreversible effect repeats."],"remediation":["Revisit Lesson 4 and EX-07–EX-08; build a separate safe implementation."]},{"criterion_id":"R05","score":0,"evidence":["modules/11-messaging-streams-workflows/assessment/calibration/repeat.md#workflow-and-recovery: Poison retries forever and reconciliation is absent."],"findings":["invariant_failure: Recovery work is unbounded and drift is undetected."],"remediation":["Revisit Lesson 5 and EX-09–EX-10; create a bounded replay/reconcile rerun."]},{"criterion_id":"R06","score":0,"evidence":["modules/11-messaging-streams-workflows/assessment/calibration/repeat.md#workflow-and-recovery: Volatile progress and repeated destructive compensation are unsafe."],"findings":["invariant_failure: Compensation repeats and can erase current state."],"remediation":["Revisit Lesson 6 and EX-11–EX-12; create a new durable workflow history."]},{"criterion_id":"R07","score":0,"evidence":["modules/11-messaging-streams-workflows/assessment/calibration/repeat.md#workflow-and-recovery: Late records are silently discarded."],"findings":["invariant_failure: Event-time results contradict the unstated drop policy."],"remediation":["Revisit Lesson 7 and EX-13; run a separate late-data correction trial."]},{"criterion_id":"R08","score":0,"evidence":["modules/11-messaging-streams-workflows/assessment/calibration/repeat.md#failure-pairs: Drain arithmetic ignores continuing arrivals."],"findings":["incorrect_reasoning: B/mu is used although arrivals continue and work is unbounded."],"remediation":["Revisit Lesson 7 and EX-14–EX-15; create a bounded capacity rerun."]},{"criterion_id":"R09","score":0,"evidence":["modules/11-messaging-streams-workflows/assessment/calibration/repeat.md#failure-pairs: Evidence was edited and pair inputs differ."],"findings":["invariant_failure: No immutable causal evidence or repaired invariant set exists."],"remediation":["Revisit Lesson 7 and EX-15; repeat all pairs with new frozen inputs."]},{"criterion_id":"R10","score":0,"evidence":["modules/11-messaging-streams-workflows/assessment/calibration/repeat.md#decision-and-defense: The RFC lacks alternatives, owners, and safe change."],"findings":["communication_gap: Architecture vocabulary substitutes for an evidence-based decision."],"remediation":["Revisit Lesson 8 and EX-16; produce a new RFC and defense after safety repair."]}],"average_score":0.1,"safety_critical_zero":true,"result":"Repeat","confidence":{"level":"high","reasons":["A second isolated reading confirms hard and safety failures."]},"summary":"Repeat. G02-G05 fail, the average is 0.1, and R04/R06/R09 are zero.","next_actions":["Preserve this invalid attempt and repeat the complete workflow with new frozen inputs."]}
