{"module_id":"M03","artifact_commit":"def2400","baseline_tag":"def2300","evaluated_at":"2026-08-04T09:38:26-07:00","structural_gates":[{"id":"G01","passed":true,"evidence":["modules/03-computer-systems-operating-systems/assessment/calibration/revise.md#Artifact and freeze record"]},{"id":"G02","passed":true,"evidence":["modules/03-computer-systems-operating-systems/assessment/calibration/revise.md#Artifact and freeze record","modules/03-computer-systems-operating-systems/assessment/calibration/manifests/revise.json#identity and chronology"]},{"id":"G03","passed":true,"evidence":["modules/03-computer-systems-operating-systems/assessment/calibration/revise.md#Artifact and freeze record","modules/03-computer-systems-operating-systems/assessment/calibration/revise.md#Machine and workload model"]},{"id":"G04","passed":true,"evidence":["modules/03-computer-systems-operating-systems/assessment/calibration/revise.md#Benchmark and mechanism evidence","modules/03-computer-systems-operating-systems/assessment/calibration/revise.md#Machine and workload model"]},{"id":"G05","passed":true,"evidence":["modules/03-computer-systems-operating-systems/assessment/calibration/revise.md#Artifact and freeze record","modules/03-computer-systems-operating-systems/assessment/calibration/revise.md#Memory, concurrency, and durability","modules/03-computer-systems-operating-systems/assessment/calibration/revise.md#Resource containment and decision"]},{"id":"G06","passed":true,"evidence":["modules/03-computer-systems-operating-systems/assessment/calibration/revise.md#Artifact and freeze record","modules/03-computer-systems-operating-systems/assessment/calibration/revise.md#Resource containment and decision"]}],"rubric_scores":[{"criterion_id":"R01","score":3,"evidence":["modules/03-computer-systems-operating-systems/assessment/calibration/revise.md#Machine and workload model: logical records, identifiers, checksums, environment, filesystem, compiler, and bounded inputs are explicit"],"findings":["communication_gap: data skew and production working-set uncertainty lack a consequence, evidence owner, and dated follow-up, preventing sensitivity-level judgment; modules/03-computer-systems-operating-systems/assessment/calibration/revise.md#Machine and workload model"],"remediation":["Module 3 Lesson 1; EX-02"]},{"criterion_id":"R02","score":2,"evidence":["modules/03-computer-systems-operating-systems/assessment/calibration/revise.md#Artifact and freeze record: frozen prediction chronology and retained raw JSON are explicit","modules/03-computer-systems-operating-systems/assessment/calibration/revise.md#Benchmark and mechanism evidence: trials retain timing, counters, outcomes, and checksums"],"findings":["missing_evidence: the report does not compare reported effects with trial spread or establish a decision-relevant confidence threshold; modules/03-computer-systems-operating-systems/assessment/calibration/revise.md#Benchmark and mechanism evidence","communication_gap: host-noise limitations are described only as ordinary laptop activity; modules/03-computer-systems-operating-systems/assessment/calibration/revise.md#Machine and workload model"],"remediation":["Module 3 Lesson 1; EX-03"]},{"criterion_id":"R03","score":2,"evidence":["modules/03-computer-systems-operating-systems/assessment/calibration/revise.md#Benchmark and mechanism evidence: contiguous access has a measured result, but competing processor explanations remain unresolved"],"findings":["unsupported_claim: the layout conclusion is not separated from compiler behavior, branch mix, or observed trial spread; modules/03-computer-systems-operating-systems/assessment/calibration/revise.md#Benchmark and mechanism evidence"],"remediation":["Module 3 Lesson 1; EX-02"]},{"criterion_id":"R04","score":2,"evidence":["modules/03-computer-systems-operating-systems/assessment/calibration/revise.md#Benchmark and mechanism evidence: context switches are measured but the scheduling diagnosis is not discriminated","modules/03-computer-systems-operating-systems/assessment/calibration/revise.md#Resource containment and decision: CPU limits and controller outcomes are recorded"],"findings":["incorrect_reasoning: rising context switches are attributed to scheduler overhead without separating lock waiting or container throttling; modules/03-computer-systems-operating-systems/assessment/calibration/revise.md#Benchmark and mechanism evidence"],"remediation":["Module 3 Lesson 2; EX-04"]},{"criterion_id":"R05","score":2,"evidence":["modules/03-computer-systems-operating-systems/assessment/calibration/revise.md#Memory, concurrency, and durability: allocation, page touching, pressure, RSS, faults, checksums, and bounded scenarios exist"],"findings":["communication_gap: elevated RSS after frees is reported without a causal account connecting allocation lifetime, reclaim, page cache, or accounting boundary; modules/03-computer-systems-operating-systems/assessment/calibration/revise.md#Memory, concurrency, and durability"],"remediation":["Module 3 Lesson 3; EX-06"]},{"criterion_id":"R06","score":3,"evidence":["modules/03-computer-systems-operating-systems/assessment/calibration/revise.md#Memory, concurrency, and durability: bounded shared-state scenarios retain correct checksums, watchdog coverage, tested lock order, and cleanup"],"findings":[],"remediation":["Module 3 Lesson 4; EX-07"]},{"criterion_id":"R07","score":2,"evidence":["modules/03-computer-systems-operating-systems/assessment/calibration/revise.md#Memory, concurrency, and durability: safe failure acknowledgement, file and directory sync, recovery ownership, and loss window are defined"],"findings":["invariant_failure: the performance comparison changes record size while changing sync policy, so equivalent work is not preserved for the durability-performance claim; modules/03-computer-systems-operating-systems/assessment/calibration/revise.md#Memory, concurrency, and durability"],"remediation":["Module 3 Lesson 5; EX-09"]},{"criterion_id":"R08","score":2,"evidence":["modules/03-computer-systems-operating-systems/assessment/calibration/revise.md#Resource containment and decision: unprivileged container bounds and CPU and memory controller outcomes are recorded"],"findings":["unsupported_claim: Docker Desktop measurements are generalized to production Linux without native Linux confirmation; modules/03-computer-systems-operating-systems/assessment/calibration/revise.md#Resource containment and decision"],"remediation":["Module 3 Lesson 7; EX-11"]},{"criterion_id":"R09","score":2,"evidence":["modules/03-computer-systems-operating-systems/assessment/calibration/revise.md#Benchmark and mechanism evidence: observations and candidate alternatives exist","modules/03-computer-systems-operating-systems/assessment/calibration/revise.md#Resource containment and decision: the contradictory layout run remains unresolved"],"findings":["missing_evidence: no discriminating test resolves the contradictory layout result or separates compiler, branch, lock-wait, and throttling explanations; modules/03-computer-systems-operating-systems/assessment/calibration/revise.md#Benchmark and mechanism evidence"],"remediation":["Module 3 Lesson 8; EX-11"]},{"criterion_id":"R10","score":2,"evidence":["modules/03-computer-systems-operating-systems/assessment/calibration/revise.md#Resource containment and decision: the submission makes a scoped choice and names an owner, rollback, and latency signal"],"findings":["communication_gap: the decision omits cost per completed record, platform and recovery commitments, migration sequencing, security effects, and a measurable reversal threshold; modules/03-computer-systems-operating-systems/assessment/calibration/revise.md#Resource containment and decision","missing_evidence: the teach-back neither explains the contradictory layout run nor answers the operations challenge with a discriminating test; modules/03-computer-systems-operating-systems/assessment/calibration/revise.md#Resource containment and decision"],"remediation":["Module 3 Lesson 8; EX-12"]}],"average_score":2.2,"safety_critical_zero":false,"result":"Revise","confidence":{"level":"high","reasons":["The fixture directly states artifact chronology, validation status, retained measurements, bounded safety behavior, and the principal causal and operational gaps; modules/03-computer-systems-operating-systems/assessment/calibration/revise.md#Artifact and freeze record","The safety-critical evidence and limitations are explicit; modules/03-computer-systems-operating-systems/assessment/calibration/revise.md#Memory, concurrency, and durability"]},"summary":"All structural gates pass and neither safety-critical criterion is zero, but the 2.20 average is below the 3.0 Pass threshold. The submission is complete and bounded, yet unresolved measurement validity, causal diagnosis, platform transfer, durability comparison, and decision-operability gaps require revision.","next_actions":["Create a new dated Module 3 Lesson 1 EX-03 measurement addendum that preserves the frozen prediction and raw trials while relating effect sizes to trial spread and host noise.","Create a new Module 3 Lesson 8 EX-11 causal-diagnosis artifact with discriminating tests for the layout, lock-wait, throttling, and platform-transfer alternatives.","Create a new Module 3 Lesson 8 EX-12 decision revision covering cost, migration, security, recovery commitments, ownership, and a measurable reversal threshold."]}
