{"module_id":"M15","artifact_commit":"15pass001","baseline_tag":"northstar-m15-pass","evaluated_at":"2026-08-04T09:47:10-07:00","structural_gates":[{"id":"G01","passed":true,"evidence":["modules/15-execution-models-across-languages/assessment/calibration/pass.md#Submission identity and chronology","modules/15-execution-models-across-languages/assessment/calibration/manifests/pass.json#root"]},{"id":"G02","passed":true,"evidence":["modules/15-execution-models-across-languages/assessment/calibration/pass.md#Submission identity and chronology","modules/15-execution-models-across-languages/assessment/calibration/pass.md#Failure and measurement evidence"]},{"id":"G03","passed":true,"evidence":["modules/15-execution-models-across-languages/assessment/calibration/pass.md#Equivalent contract and four runtimes","modules/15-execution-models-across-languages/assessment/calibration/pass.md#Submission identity and chronology"]},{"id":"G04","passed":true,"evidence":["modules/15-execution-models-across-languages/assessment/calibration/pass.md#Memory, scheduler, visibility, and boundary evidence","modules/15-execution-models-across-languages/assessment/calibration/pass.md#Equivalent contract and four runtimes","modules/15-execution-models-across-languages/assessment/calibration/pass.md#Failure and measurement evidence"]},{"id":"G05","passed":true,"evidence":["modules/15-execution-models-across-languages/assessment/calibration/pass.md#Failure and measurement evidence"]},{"id":"G06","passed":true,"evidence":["modules/15-execution-models-across-languages/assessment/calibration/pass.md#Decision, defense, and Gate 5"]}],"rubric_scores":[{"criterion_id":"R01","score":3,"evidence":["modules/15-execution-models-across-languages/assessment/calibration/pass.md#Equivalent contract and four runtimes","modules/15-execution-models-across-languages/assessment/calibration/pass.md#Submission identity and chronology"],"findings":[],"remediation":["Sustain equivalent-work auditing through Module 15 Lesson L06 and EX-10."]},{"criterion_id":"R02","score":3,"evidence":["modules/15-execution-models-across-languages/assessment/calibration/pass.md#Memory, scheduler, visibility, and boundary evidence","modules/15-execution-models-across-languages/assessment/calibration/pass.md#Failure and measurement evidence"],"findings":[],"remediation":["Sustain owner, release, and retention analysis through Module 15 Lesson L01 and EX-01\u201302."]},{"criterion_id":"R03","score":3,"evidence":["modules/15-execution-models-across-languages/assessment/calibration/pass.md#Memory, scheduler, visibility, and boundary evidence","modules/15-execution-models-across-languages/assessment/calibration/pass.md#Failure and measurement evidence"],"findings":[],"remediation":["Sustain scheduler placement and queue telemetry through Module 15 Lesson L02 and EX-03\u201304."]},{"criterion_id":"R04","score":3,"evidence":["modules/15-execution-models-across-languages/assessment/calibration/pass.md#Memory, scheduler, visibility, and boundary evidence","modules/15-execution-models-across-languages/assessment/calibration/pass.md#Equivalent contract and four runtimes"],"findings":[],"remediation":["Sustain boundary-validation coverage through Module 15 Lesson L05 and EX-14\u201315."]},{"criterion_id":"R05","score":3,"evidence":["modules/15-execution-models-across-languages/assessment/calibration/pass.md#Equivalent contract and four runtimes","modules/15-execution-models-across-languages/assessment/calibration/pass.md#Failure and measurement evidence"],"findings":[],"remediation":["Sustain bounded fan-out and deadline evidence through Module 15 Lesson L03 and EX-06\u201308."]},{"criterion_id":"R06","score":3,"evidence":["modules/15-execution-models-across-languages/assessment/calibration/pass.md#Memory, scheduler, visibility, and boundary evidence","modules/15-execution-models-across-languages/assessment/calibration/pass.md#Failure and measurement evidence"],"findings":[],"remediation":["Sustain happens-before, detector, and oracle evidence through Module 15 Lesson L04 and EX-12\u201313."]},{"criterion_id":"R07","score":3,"evidence":["modules/15-execution-models-across-languages/assessment/calibration/pass.md#Equivalent contract and four runtimes","modules/15-execution-models-across-languages/assessment/calibration/pass.md#Memory, scheduler, visibility, and boundary evidence","modules/15-execution-models-across-languages/assessment/calibration/pass.md#Failure and measurement evidence"],"findings":[],"remediation":["Sustain cancellation and zero-delta cleanup trials through Module 15 Lesson L03 and EX-08."]},{"criterion_id":"R08","score":3,"evidence":["modules/15-execution-models-across-languages/assessment/calibration/pass.md#Submission identity and chronology","modules/15-execution-models-across-languages/assessment/calibration/pass.md#Failure and measurement evidence"],"findings":[],"remediation":["Sustain frozen chronology and paired-trial integrity through Module 15 Lesson L06 and EX-17."]},{"criterion_id":"R09","score":3,"evidence":["modules/15-execution-models-across-languages/assessment/calibration/pass.md#Decision, defense, and Gate 5"],"findings":[],"remediation":["Sustain owned adoption, rollback, and exit planning through Module 15 Lesson L08 and EX-18."]},{"criterion_id":"R10","score":3,"evidence":["modules/15-execution-models-across-languages/assessment/calibration/pass.md#Decision, defense, and Gate 5"],"findings":[],"remediation":["Sustain reversible decision defense through Module 15 Lesson L08 and EX-18."]}],"average_score":3.0,"safety_critical_zero":false,"result":"Pass","confidence":{"level":"high","reasons":["The fixture explicitly identifies all required artifacts and four runtime implementations.","Frozen chronology, paired repairs, restored invariants, validation, cleanup, and reversible decision evidence are stated consistently.","No criterion receives level 4 because the fixture does not explicitly establish every published level-4 anchor."]},"summary":"Pass: all structural gates are satisfied, all ten criteria meet level 3, the arithmetic mean is 3.00, and no safety-critical criterion is zero.","next_actions":["Preserve the frozen evidence bundle and independent critique.","Continue equivalence and chronology checks with Module 15 Lesson L06 and EX-10 and EX-17.","Continue reversible ownership review with Module 15 Lesson L08 and EX-18."]}
