{"module_id":"M11","artifact_commit":"m11-pass-4a1b2c3","baseline_tag":"m11-pass-baseline","evaluated_at":"2026-08-04T15:25:00-07:00","structural_gates":[{"id":"G01","passed":true,"evidence":["modules/11-messaging-streams-workflows/assessment/calibration/pass.md#Submission identity: The manifest resolves A01\u2013A09 and records the frozen baseline, environment, assistance, schemas, and scenario/trial hashes.","modules/11-messaging-streams-workflows/assessment/calibration/manifests/pass.json#identity: The manifest identifies artifact commit m11-pass-4a1b2c3, baseline tag m11-pass-baseline, and the Northstar fixture."]},{"id":"G02","passed":true,"evidence":["modules/11-messaging-streams-workflows/assessment/calibration/pass.md#Failure pairs: F01\u2013F09 predictions explicitly predate the 18 immutable trials."]},{"id":"G03","passed":true,"evidence":["modules/11-messaging-streams-workflows/assessment/calibration/pass.md#Build and evidence: The passing standard-library build exposes authority/outbox and inbox/projection transactions, deterministic log positions, effects, workflow history, poison, watermarks, metrics, and reconciliation; tests and schemas pass."]},{"id":"G04","passed":true,"evidence":["modules/11-messaging-streams-workflows/assessment/calibration/pass.md#Failure pairs: Each immutable pair shares its seed and input, changes one control, produces the expected broken failure, passes repaired I01\u2013I12, and permits drain and watermark arithmetic to be recalculated."]},{"id":"G05","passed":true,"evidence":["modules/11-messaging-streams-workflows/assessment/calibration/pass.md#Authority and semantics: Atomic outbox intent, stable identities, and a locally scoped exactly-once boundary support safe publication and application.","modules/11-messaging-streams-workflows/assessment/calibration/pass.md#Workflow and recovery: Valid transitions, idempotent step keys, compensation, a point of no return, manual review, late-data correction, bounded poison handling, and authority-led reconciliation are evidenced."]},{"id":"G06","passed":true,"evidence":["modules/11-messaging-streams-workflows/assessment/calibration/pass.md#Decision and defense: The RFC compares direct, queue, log/choreography, and orchestration alternatives and covers security, cost, migration, rollback, ownership, dissent, telemetry, reversal, and separately preserved evaluation/remediation."]}],"rubric_scores":[{"criterion_id":"R01","score":3,"evidence":["modules/11-messaging-streams-workflows/assessment/calibration/pass.md#Authority and semantics: Registry-owned publication facts, atomic outbox intent, stable event and workflow identities, and a bounded exactly-once claim align authority, events, effects, and derived state."],"findings":[],"remediation":["No remediation is required; preserve this evidence and use Module 11 Lesson 1, EX-01\u2013EX-02 for any future authority or envelope extension."]},{"criterion_id":"R02","score":3,"evidence":["modules/11-messaging-streams-workflows/assessment/calibration/pass.md#Authority and semantics: Stable event, inbox, workflow-step, and bulletin-effect identities are retained, while exactly-once semantics are limited to the local inbox/projection transaction boundary.","modules/11-messaging-streams-workflows/assessment/calibration/pass.md#Failure pairs: Broken and repaired paired trials exercise the stated delivery behavior with immutable shared inputs."],"findings":[],"remediation":["No remediation is required; preserve this evidence and use Module 11 Lesson 2, EX-03\u2013EX-04 for additional crash/ack or effect-key trials."]},{"criterion_id":"R03","score":3,"evidence":["modules/11-messaging-streams-workflows/assessment/calibration/pass.md#Build and evidence: Deterministic log positions and passing tests provide executable ordering evidence.","modules/11-messaging-streams-workflows/assessment/calibration/pass.md#Failure pairs: Shared-input, single-control pairs with repaired I01\u2013I12 provide the fixture's invariant evidence for ordering and processing behavior."],"findings":[],"remediation":["No remediation is required; preserve this evidence and use Module 11 Lesson 3, EX-05\u2013EX-06 for future skew, version, or reassignment variants."]},{"criterion_id":"R04","score":3,"evidence":["modules/11-messaging-streams-workflows/assessment/calibration/pass.md#Authority and semantics: Publication intent commits atomically and stable event, inbox, and effect identities are retained.","modules/11-messaging-streams-workflows/assessment/calibration/pass.md#Build and evidence: Executable authority/outbox and inbox/projection transactions, deterministic log positions, and effects support restartable publication and idempotent application."],"findings":[],"remediation":["No remediation is required; preserve this evidence and use Module 11 Lesson 4, EX-07\u2013EX-08 for any new atomicity, CDC, or restart boundary."]},{"criterion_id":"R05","score":3,"evidence":["modules/11-messaging-streams-workflows/assessment/calibration/pass.md#Workflow and recovery: Bounded poison handling, late-data corrections, and authority-led reconciliation are evidenced without production overclaim.","modules/11-messaging-streams-workflows/assessment/calibration/pass.md#Build and evidence: The build exposes poison handling, watermarks, metrics, and reconciliation."],"findings":[],"remediation":["No remediation is required; preserve this evidence and use Module 11 Lesson 5, EX-09\u2013EX-10 for additional shadow-rebuild, poison, or reconciliation variants."]},{"criterion_id":"R06","score":3,"evidence":["modules/11-messaging-streams-workflows/assessment/calibration/pass.md#Workflow and recovery: Valid transitions, stable step keys, compensation, a point of no return, manual review, and reconciliation provide durable and safe workflow recovery evidence.","modules/11-messaging-streams-workflows/assessment/calibration/pass.md#Build and evidence: Workflow history and effects are exposed by the executable build."],"findings":[],"remediation":["No remediation is required; preserve this evidence and use Module 11 Lesson 6, EX-11\u2013EX-12 for future workflow-interleaving or compensation trials."]},{"criterion_id":"R07","score":3,"evidence":["modules/11-messaging-streams-workflows/assessment/calibration/pass.md#Workflow and recovery: Late-data corrections are evidenced as part of recovery behavior.","modules/11-messaging-streams-workflows/assessment/calibration/pass.md#Failure pairs: Watermark arithmetic recalculates across immutable paired trials."],"findings":[],"remediation":["No remediation is required; preserve this evidence and use Module 11 Lesson 7, EX-13 for additional late-data or watermark-distribution trials."]},{"criterion_id":"R08","score":3,"evidence":["modules/11-messaging-streams-workflows/assessment/calibration/pass.md#Failure pairs: Drain arithmetic recalculates across shared-input, single-control trials.","modules/11-messaging-streams-workflows/assessment/calibration/pass.md#Build and evidence: The build exposes poison handling and metrics needed to observe recovery behavior."],"findings":[],"remediation":["No remediation is required; preserve this evidence and use Module 11 Lesson 7, EX-14\u2013EX-15 for additional partition-capacity, burst, or backpressure trials."]},{"criterion_id":"R09","score":3,"evidence":["modules/11-messaging-streams-workflows/assessment/calibration/pass.md#Submission identity: The frozen baseline, schemas, and scenario/trial hashes are present.","modules/11-messaging-streams-workflows/assessment/calibration/pass.md#Failure pairs: Predictions predate 18 immutable trials; every pair shares seed/input, changes one control, exhibits the broken failure, passes repaired I01\u2013I12, and supports arithmetic recalculation."],"findings":[],"remediation":["No remediation is required; preserve the immutable bundle and use Module 11 Lessons 2\u20137, EX-15 if entirely new paired evidence is ever required."]},{"criterion_id":"R10","score":3,"evidence":["modules/11-messaging-streams-workflows/assessment/calibration/pass.md#Decision and defense: The evidence-driven RFC covers alternatives, security, cost, migration, rollback, owners, dissent, telemetry, reversal, and separately preserved remediation.","modules/11-messaging-streams-workflows/assessment/calibration/pass.md#Workflow and recovery: Recovery claims are expressly bounded to the evidence and avoid production overclaim."],"findings":[],"remediation":["No remediation is required; preserve the decision record and use Module 11 Lesson 8, EX-16 for any dated RFC revision or defense follow-up."]}],"average_score":3.0,"safety_critical_zero":false,"result":"Pass","confidence":{"level":"high","reasons":["The fixture explicitly attests that all required artifacts resolve, predictions predate results, all paired trials are immutable and controlled, repaired I01\u2013I12 pass, and arithmetic recalculates.","The executable build, workflow recovery evidence, and RFC coverage directly address all six structural gates.","No criterion received level 4 because the fixture does not explicitly provide the independent environments, discriminating variants, or frozen transfer exercise required by the level-4 anchors."]},"summary":"Pass. All structural gates pass, the ten rubric scores average 3.00, and none of the safety-critical criteria R04, R06, or R09 is zero. The immutable bundle supports aligned asynchronous contracts, repaired invariants, bounded recovery, and an evidence-driven RFC without unsupported production guarantees.","next_actions":["Preserve the immutable artifact commit and baseline tag without overwriting prior evidence.","Record this passing independent evaluation against the same frozen bundle to establish Independently Validated status.","Use the named Module 11 lessons and EX exercises only when creating new evidence for future extensions."]}
