{"module_id":"M06","artifact_commit":"fixture-m06-pass","baseline_tag":"fixture-m06-pass-baseline","evaluated_at":"2026-08-01T00:00:00-07:00","structural_gates":[{"id":"G01","passed":true,"evidence":["modules/06-deadlines-resilient-remote-calls/assessment/calibration/pass.md#submission-identity: identifies the immutable artifact commit, frozen baseline, runtime, evidence paths, hashes, and assistance disclosure."]},{"id":"G02","passed":true,"evidence":["modules/06-deadlines-resilient-remote-calls/assessment/calibration/pass.md#frozen-call-graph-and-deadline-model: states that the usefulness deadline and allocations predated results.","modules/06-deadlines-resilient-remote-calls/assessment/calibration/pass.md#six-fault-evidence-and-diagnosis: preserves pre-result predictions for F01–F06."]},{"id":"G03","passed":true,"evidence":["modules/06-deadlines-resilient-remote-calls/assessment/calibration/pass.md#six-fault-evidence-and-diagnosis: reports matching fingerprints and agreement across attempt, completeness, effect, concurrency, cancellation, cleanup, and useful-work evidence."]},{"id":"G04","passed":true,"evidence":["modules/06-deadlines-resilient-remote-calls/assessment/calibration/pass.md#six-fault-evidence-and-diagnosis: covers all F01–F06 with predictions, raw outputs, hashes, alternatives, isolated repairs, and same-input reruns.","modules/06-deadlines-resilient-remote-calls/assessment/calibration/pass.md#cancellation-and-bounded-build: covers queued, active, loop, child, retry, response, schema, and same-input cancellation observation points."]},{"id":"G05","passed":true,"evidence":["modules/06-deadlines-resilient-remote-calls/assessment/calibration/pass.md#idempotency-and-partial-outcomes: proves one authoritative effect, conflict rejection, atomic claim/effect/outcome handling, and explicit partial-result semantics.","modules/06-deadlines-resilient-remote-calls/assessment/calibration/pass.md#pool-fairness-health-and-security: supplies total, dependency, tenant, queue, health, security, and cleanup bounds."]},{"id":"G06","passed":true,"evidence":["modules/06-deadlines-resilient-remote-calls/assessment/calibration/pass.md#teach-back-gate-2-and-remediation: records the defense, cross-functional challenges, dissent, reversal experiment, Week 24 revision, and immutable prior evidence."]}],"rubric_scores":[{"criterion_id":"R01","score":4,"evidence":["modules/06-deadlines-resilient-remote-calls/assessment/calibration/pass.md#frozen-call-graph-and-deadline-model: propagates a 420 ms deadline through admission, parallel fan-out, assembly, delivery, and cleanup, with remaining-budget observations and decision-reversing sensitivity."],"findings":[],"remediation":["Sustain with Lesson 1 and EX-01–EX-02 by preserving the allocation sensitivity and whole-journey rerun evidence."]},{"criterion_id":"R02","score":3,"evidence":["modules/06-deadlines-resilient-remote-calls/assessment/calibration/pass.md#cancellation-and-bounded-build: demonstrates signal observation, prevention of new child work, a bounded atomic exception, permit recovery, zero pending work, and a 25 ms drain."],"findings":["missing_evidence: the submission does not demonstrate adversarial cancellation timing across multiple runtime adapters required for the score-4 anchor."],"remediation":["Extend through Lesson 2 and EX-03–EX-04 with an addendum covering adversarial cancel timing and adapter-specific drain evidence."]},{"criterion_id":"R03","score":3,"evidence":["modules/06-deadlines-resilient-remote-calls/assessment/calibration/pass.md#retry-and-useful-work-evidence: establishes one retry owner, eligibility and remaining-time checks, capped full jitter, attempt and tenant budgets, useful-work comparison, and overload recovery."],"findings":["missing_evidence: no retry sensitivity series or sustained-recovery trial quantifies where the selected policy reverses, as required for score 4."],"remediation":["Extend through Lesson 3 and EX-05–EX-06 with a bounded sensitivity and sustained-recovery rerun."]},{"criterion_id":"R04","score":3,"evidence":["modules/06-deadlines-resilient-remote-calls/assessment/calibration/pass.md#idempotency-and-partial-outcomes: covers scoped canonical keys, authoritative effect proof, concurrency, replay, conflict handling, and lock-protected claim/effect/outcome atomicity."],"findings":["missing_evidence: expiry, crash-boundary, and adversarial authorization trials are not independently reported for the score-4 anchor."],"remediation":["Extend through Lesson 4 and EX-07–EX-08 with the smallest concurrent crash, expiry, and authorization addendum."]},{"criterion_id":"R05","score":3,"evidence":["modules/06-deadlines-resilient-remote-calls/assessment/calibration/pass.md#pool-fairness-health-and-security: measured capacity supports total, dependency, tenant, queue, and isolated-health limits with early rejection and complete cleanup."],"findings":["missing_evidence: distinct burst, tenant-skew, drain, and failover-reserve trials are not reported sufficiently to reach score 4."],"remediation":["Extend through Lessons 5 and 7 with EX-09 and EX-12 using bounded skew, drain, and failover reruns."]},{"criterion_id":"R06","score":3,"evidence":["modules/06-deadlines-resilient-remote-calls/assessment/calibration/pass.md#six-fault-evidence-and-diagnosis: F01–F06 preserve predictions, raw outputs, hashes, labels, alternatives, isolated repairs, uncertainty, and same-input reruns with consistent arithmetic."],"findings":["missing_evidence: the submission does not show discriminating reruns that explicitly falsify strong alternatives and explain failed initial hypotheses for the score-4 anchor."],"remediation":["Extend through Lessons 1–6 and EX-13–EX-14 with a discriminating rerun addendum while preserving all original evidence."]},{"criterion_id":"R07","score":3,"evidence":["modules/06-deadlines-resilient-remote-calls/assessment/calibration/pass.md#idempotency-and-partial-outcomes: authoritative effect count and explicit required-versus-optional completeness semantics agree.","modules/06-deadlines-resilient-remote-calls/assessment/calibration/pass.md#pool-fairness-health-and-security: concurrency, tenant, queue, redaction, endpoint, and cleanup bounds agree with the safety contract.","modules/06-deadlines-resilient-remote-calls/assessment/calibration/pass.md#cancellation-and-bounded-build: cancellation drains all active, queued, permit, and pending-task state to zero."] ,"findings":["missing_evidence: independent crash, corruption, overload, and authorization trials do not reproduce every safety invariant required for score 4."],"remediation":["Extend through Lesson 4 and EX-07–EX-08 with bounded crash, corruption, overload, and authorization safety trials."]},{"criterion_id":"R08","score":3,"evidence":["modules/06-deadlines-resilient-remote-calls/assessment/calibration/pass.md#alternatives-policy-migration-and-cost: compares fixed bounds, no retry, caller-owned bounded retry, breakers, and hedges using idempotency, correlation, capacity, p99 benefit, cost, and recovery conditions.","modules/06-deadlines-resilient-remote-calls/assessment/calibration/pass.md#idempotency-and-partial-outcomes: defines unavailable required data and degraded optional data with provenance."] ,"findings":["missing_evidence: controlled trigger-and-recovery trials do not quantify where each resilience alternative wins or reverses for score 4."],"remediation":["Extend through Lesson 6 and EX-10–EX-11 with one controlled alternative experiment covering trigger, recovery, user outcome, and duplicate cost."]},{"criterion_id":"R09","score":3,"evidence":["modules/06-deadlines-resilient-remote-calls/assessment/calibration/pass.md#alternatives-policy-migration-and-cost: evidence-backed policy covers operation behavior, security, useful-work cost, staged migration, retry canary, rollback, owners, and exceptions."],"findings":["missing_evidence: a mixed-version canary and explicit rollback rehearsal resolving cross-team disagreement are absent from the score-4 evidence."],"remediation":["Extend through Lesson 8 and EX-15–EX-16 with a dated mixed-version canary and rollback-rehearsal addendum."]},{"criterion_id":"R10","score":3,"evidence":["modules/06-deadlines-resilient-remote-calls/assessment/calibration/pass.md#teach-back-gate-2-and-remediation: the defense derives core mechanisms, handles cross-functional challenges, records dissent and changed belief, and keeps remediation separate from immutable evidence."],"findings":["missing_evidence: no evidence shows another team applying the method to a different stack and resolving a real policy disagreement, as required for score 4."],"remediation":["Extend through Lesson 8 and EX-16 with a follow-up defense documenting independent application by another team."]}],"average_score":3.1,"safety_critical_zero":false,"result":"Pass","confidence":{"level":"high","reasons":["The manifest identifies one immutable fixture and the submission provides direct heading-level evidence for every gate and rubric row.","The submission explicitly reports preserved predictions, raw evidence, hashes, same-input reruns, authoritative effects, arithmetic agreement, and bounded cleanup.","Score-4 distinctions were withheld where the fixture did not explicitly report the rubric's additional adversarial or cross-team evidence."]},"summary":"Pass. All structural gates pass, the mean score is 3.1, and both safety-critical criteria are nonzero. The submission demonstrates a complete bounded remote-call design and consistent failure evidence; remaining findings concern score-4 extensions rather than material safety or integrity failures.","next_actions":["Preserve the frozen baseline, raw trials, policy, and current evaluation unchanged.","If pursuing score-4 evidence, add only dated, bounded extensions using the cited Lesson and EX remediation work."]}