{"module_id":"M03","artifact_commit":"abc2400","baseline_tag":"abc2300","evaluated_at":"2026-08-04T09:38:18-07:00","structural_gates":[{"id":"G01","passed":true,"evidence":["modules/03-computer-systems-operating-systems/assessment/calibration/pass.md#Artifact and freeze record","modules/03-computer-systems-operating-systems/assessment/calibration/manifests/pass.json#identity and chronology"]},{"id":"G02","passed":true,"evidence":["modules/03-computer-systems-operating-systems/assessment/calibration/pass.md#Artifact and freeze record","modules/03-computer-systems-operating-systems/assessment/calibration/manifests/pass.json#identity and chronology"]},{"id":"G03","passed":true,"evidence":["modules/03-computer-systems-operating-systems/assessment/calibration/pass.md#Artifact and freeze record","modules/03-computer-systems-operating-systems/assessment/calibration/pass.md#Machine and workload model","modules/03-computer-systems-operating-systems/assessment/calibration/pass.md#Concurrency and durability safety"]},{"id":"G04","passed":true,"evidence":["modules/03-computer-systems-operating-systems/assessment/calibration/pass.md#Machine and workload model","modules/03-computer-systems-operating-systems/assessment/calibration/pass.md#Benchmark method and processor findings","modules/03-computer-systems-operating-systems/assessment/calibration/pass.md#Scheduling and memory findings"]},{"id":"G05","passed":true,"evidence":["modules/03-computer-systems-operating-systems/assessment/calibration/pass.md#Resource containment and required matrix","modules/03-computer-systems-operating-systems/assessment/calibration/pass.md#Concurrency and durability safety"]},{"id":"G06","passed":true,"evidence":["modules/03-computer-systems-operating-systems/assessment/calibration/pass.md#Diagnosis, decision, and defense"]}],"rubric_scores":[{"criterion_id":"R01","score":4,"evidence":["modules/03-computer-systems-operating-systems/assessment/calibration/pass.md#Machine and workload model: logical work, checksums, host and toolchain identity, data shape, runtime, filesystem, constraints, scoped claims, and an owned Linux-host sensitivity follow-up are explicit."],"findings":[],"remediation":["Module 3 Lesson 1; EX-01"]},{"criterion_id":"R02","score":4,"evidence":["modules/03-computer-systems-operating-systems/assessment/calibration/pass.md#Artifact and freeze record: the prediction is frozen before unchanged raw trials.","modules/03-computer-systems-operating-systems/assessment/calibration/pass.md#Benchmark method and processor findings: monotonic timing, warm-up separation, repetitions, counters, checksums, variance, effect threshold, and competing explanations support reproducibility. "],"findings":[],"remediation":["Module 3 Lesson 1; EX-03"]},{"criterion_id":"R03","score":3,"evidence":["modules/03-computer-systems-operating-systems/assessment/calibration/pass.md#Benchmark method and processor findings: access layout, branch-only reruns, enlarged working sets, assembly, checksums, and observed reversal form a scoped causal chain."],"findings":["missing_evidence: the fixture does not explicitly separate NUMA from the reproduced reversal, so the full level-4 alternative set is not demonstrated; modules/03-computer-systems-operating-systems/assessment/calibration/pass.md#Benchmark method and processor findings"],"remediation":["Module 3 Lesson 1; EX-02"]},{"criterion_id":"R04","score":3,"evidence":["modules/03-computer-systems-operating-systems/assessment/calibration/pass.md#Scheduling and memory findings: runnable threads, useful throughput, CPU time, context switches, quota periods, throttling, and lock wait support the scheduling diagnosis.","modules/03-computer-systems-operating-systems/assessment/calibration/pass.md#Concurrency and durability safety: batching variants distinguish relevant syscall and synchronization boundaries."],"findings":["missing_evidence: controlled variants do not explicitly separate scheduler, syscall, lock, and device-queue explanations across the claimed production boundary; modules/03-computer-systems-operating-systems/assessment/calibration/pass.md#Scheduling and memory findings"],"remediation":["Module 3 Lesson 2; EX-04"]},{"criterion_id":"R05","score":3,"evidence":["modules/03-computer-systems-operating-systems/assessment/calibration/pass.md#Scheduling and memory findings: allocation lifetime variants, page touching, RSS, faults, cgroup events, bounded pressure, outcomes, and equal checksums connect memory behavior to containment."],"findings":["missing_evidence: repeated trials explicitly distinguishing allocator, page-cache, reclaim, and cgroup explanations are not all described; modules/03-computer-systems-operating-systems/assessment/calibration/pass.md#Scheduling and memory findings"],"remediation":["Module 3 Lesson 3; EX-06"]},{"criterion_id":"R06","score":3,"evidence":["modules/03-computer-systems-operating-systems/assessment/calibration/pass.md#Concurrency and durability safety: exact counts, equivalent work, lock ordering, fail-closed configuration, bounded deadlock execution, watchdog termination, and cleanup establish tested safety invariants."],"findings":["missing_evidence: broad adversarial schedules preserving observability and an auditable concurrency-specific rollout path are not explicit; modules/03-computer-systems-operating-systems/assessment/calibration/pass.md#Concurrency and durability safety"],"remediation":["Module 3 Lesson 4; EX-08"]},{"criterion_id":"R07","score":4,"evidence":["modules/03-computer-systems-operating-systems/assessment/calibration/pass.md#Concurrency and durability safety: buffered and sync variants define acknowledgement boundaries, reject partial-write and sync failures, test a bounded crash window, retain recovery ownership, and bound replay loss.","modules/03-computer-systems-operating-systems/assessment/calibration/pass.md#Diagnosis, decision, and defense: the decision retains the durability boundary and includes cost, ownership, rollout, rollback, and reversal conditions."],"findings":[],"remediation":["Module 3 Lesson 6; EX-10"]},{"criterion_id":"R08","score":3,"evidence":["modules/03-computer-systems-operating-systems/assessment/calibration/pass.md#Resource containment and required matrix: unprivileged CPU, memory, PID, storage, and I/O constraints have controller evidence, bounded outcomes, and explicit runtime limitations.","modules/03-computer-systems-operating-systems/assessment/calibration/pass.md#Diagnosis, decision, and defense: operational owners, staged rollout, rollback, and reversal conditions are named."],"findings":["missing_evidence: combined-limit and noisy-neighbor results are not explicitly tied to alert thresholds, capacity commitments, and cross-team obligations; modules/03-computer-systems-operating-systems/assessment/calibration/pass.md#Resource containment and required matrix"],"remediation":["Module 3 Lesson 7; EX-11"]},{"criterion_id":"R09","score":4,"evidence":["modules/03-computer-systems-operating-systems/assessment/calibration/pass.md#Benchmark method and processor findings: assembly, checksums, branch-only interventions, working-set changes, counters, and retained alternatives discriminate competing explanations.","modules/03-computer-systems-operating-systems/assessment/calibration/pass.md#Diagnosis, decision, and defense: observations, interpretations, four alternatives, discriminating tests, residual uncertainty, and the failed prediction form a preserved causal chain."],"findings":[],"remediation":["Module 3 Lesson 8; EX-12"]},{"criterion_id":"R10","score":4,"evidence":["modules/03-computer-systems-operating-systems/assessment/calibration/pass.md#Diagnosis, decision, and defense: the scoped decision connects mechanism, durability, cost, ownership, staged migration, rollback, reversal conditions, a counterintuitive failed prediction, and an evidence-based operations response."],"findings":[],"remediation":["Module 3 Lesson 8; EX-12"]}],"average_score":3.5,"safety_critical_zero":false,"result":"Pass","confidence":{"level":"high","reasons":["The fixture directly states that the complete artifact set, validation, tests, sanitizers, Linux checks, raw-trial integrity, and required experiment matrix pass; modules/03-computer-systems-operating-systems/assessment/calibration/pass.md#Artifact and freeze record","Identity and chronology agree between the fixture and immutable manifest; modules/03-computer-systems-operating-systems/assessment/calibration/manifests/pass.json#identity and chronology","All hard gates have direct fixture support, and both safety-critical criteria have explicit bounded safety evidence; modules/03-computer-systems-operating-systems/assessment/calibration/pass.md#Concurrency and durability safety"]},"summary":"Pass: all six structural gates pass, no hard-gate or safety-critical failure applies, R06 and R07 are nonzero, and the independently verified mean is 3.50. Level 4 was awarded only where the fixture explicitly supplies adversarial, reproducible, and teachable evidence.","next_actions":["Preserve the frozen prediction and raw trials; add a new dated Module 3 Lesson 1 EX-02 artifact testing NUMA as an alternative explanation.","Add a new dated Module 3 Lesson 2 EX-04 controlled comparison separating scheduler, syscall, lock, and device-queue effects.","Add a new dated Module 3 Lesson 7 EX-11 operational addendum connecting combined resource limits to alerting and capacity commitments."]}
