{"module_id":"M15","artifact_commit":"15pass001","baseline_tag":"northstar-m15-pass","evaluated_at":"2026-08-04T09:46:15-07:00","structural_gates":[{"id":"G01","passed":true,"evidence":["modules/15-execution-models-across-languages/assessment/calibration/pass.md#Submission identity and chronology","modules/15-execution-models-across-languages/assessment/calibration/manifests/pass.json#manifest"]},{"id":"G02","passed":true,"evidence":["modules/15-execution-models-across-languages/assessment/calibration/pass.md#Submission identity and chronology","modules/15-execution-models-across-languages/assessment/calibration/pass.md#Failure and measurement evidence"]},{"id":"G03","passed":true,"evidence":["modules/15-execution-models-across-languages/assessment/calibration/pass.md#Equivalent contract and four runtimes"]},{"id":"G04","passed":true,"evidence":["modules/15-execution-models-across-languages/assessment/calibration/pass.md#Memory, scheduler, visibility, and boundary evidence","modules/15-execution-models-across-languages/assessment/calibration/pass.md#Equivalent contract and four runtimes"]},{"id":"G05","passed":true,"evidence":["modules/15-execution-models-across-languages/assessment/calibration/pass.md#Failure and measurement evidence"]},{"id":"G06","passed":true,"evidence":["modules/15-execution-models-across-languages/assessment/calibration/pass.md#Decision, defense, and Gate 5"]}],"rubric_scores":[{"criterion_id":"R01","score":3,"evidence":["modules/15-execution-models-across-languages/assessment/calibration/pass.md#Equivalent contract and four runtimes","modules/15-execution-models-across-languages/assessment/calibration/pass.md#Submission identity and chronology"],"findings":[],"remediation":["Maintain equivalence discipline through Module 15 Lesson L06 and EX-10."]},{"criterion_id":"R02","score":3,"evidence":["modules/15-execution-models-across-languages/assessment/calibration/pass.md#Memory, scheduler, visibility, and boundary evidence","modules/15-execution-models-across-languages/assessment/calibration/pass.md#Failure and measurement evidence"],"findings":[],"remediation":["Maintain lifetime analysis through Module 15 Lesson L01 and EX-01\u201302."]},{"criterion_id":"R03","score":3,"evidence":["modules/15-execution-models-across-languages/assessment/calibration/pass.md#Memory, scheduler, visibility, and boundary evidence","modules/15-execution-models-across-languages/assessment/calibration/pass.md#Failure and measurement evidence"],"findings":[],"remediation":["Maintain scheduler and queue analysis through Module 15 Lesson L02 and EX-03\u201304."]},{"criterion_id":"R04","score":3,"evidence":["modules/15-execution-models-across-languages/assessment/calibration/pass.md#Memory, scheduler, visibility, and boundary evidence","modules/15-execution-models-across-languages/assessment/calibration/pass.md#Equivalent contract and four runtimes"],"findings":[],"remediation":["Maintain boundary-validation coverage through Module 15 Lesson L05 and EX-14\u201315."]},{"criterion_id":"R05","score":3,"evidence":["modules/15-execution-models-across-languages/assessment/calibration/pass.md#Equivalent contract and four runtimes","modules/15-execution-models-across-languages/assessment/calibration/pass.md#Failure and measurement evidence"],"findings":[],"remediation":["Maintain bounded fan-out and deadline evidence through Module 15 Lesson L03 and EX-06\u201308."]},{"criterion_id":"R06","score":3,"evidence":["modules/15-execution-models-across-languages/assessment/calibration/pass.md#Memory, scheduler, visibility, and boundary evidence"],"findings":[],"remediation":["Maintain race and visibility evidence through Module 15 Lesson L04 and EX-12\u201313."]},{"criterion_id":"R07","score":3,"evidence":["modules/15-execution-models-across-languages/assessment/calibration/pass.md#Equivalent contract and four runtimes","modules/15-execution-models-across-languages/assessment/calibration/pass.md#Memory, scheduler, visibility, and boundary evidence"],"findings":[],"remediation":["Maintain cancellation and cleanup coverage through Module 15 Lesson L03 and EX-08."]},{"criterion_id":"R08","score":3,"evidence":["modules/15-execution-models-across-languages/assessment/calibration/pass.md#Submission identity and chronology","modules/15-execution-models-across-languages/assessment/calibration/pass.md#Failure and measurement evidence"],"findings":[],"remediation":["Maintain frozen evidence chronology through Module 15 Lesson L06 and EX-17."]},{"criterion_id":"R09","score":3,"evidence":["modules/15-execution-models-across-languages/assessment/calibration/pass.md#Decision, defense, and Gate 5"],"findings":[],"remediation":["Maintain operational ownership and reversible adoption planning through Module 15 Lesson L08 and EX-18."]},{"criterion_id":"R10","score":3,"evidence":["modules/15-execution-models-across-languages/assessment/calibration/pass.md#Decision, defense, and Gate 5"],"findings":[],"remediation":["Maintain decision defense and teach-back practice through Module 15 Lesson L08 and EX-18."]}],"average_score":3.0,"safety_critical_zero":false,"result":"Pass","confidence":{"level":"high","reasons":["The fixture explicitly identifies all required artifacts, four runtimes, frozen chronology, paired repairs, restored invariants, reversible decision scope, defense, Gate 5, and separate revision.","All hard gates have affirmative fixture evidence, and the safety-critical criteria R05\u2013R08 each meet the level-3 anchor.","Scores are limited to level 3 because the fixture does not explicitly establish every additional level-4 condition."]},"summary":"Pass: all six structural gates pass, all ten rubric criteria score 3, the arithmetic mean is 3.00, and no safety-critical criterion is zero.","next_actions":["Preserve the frozen submission and evaluation record.","Continue reinforcement with Module 15 Lesson L06 and EX-17 for chronology, and Module 15 Lesson L08 and EX-18 for reversible decision ownership."]}
