{"module_id":"M15","artifact_commit":"15repeat1","baseline_tag":null,"evaluated_at":"2026-08-04T15:32:13-07:00","structural_gates":[{"id":"G01","passed":false,"evidence":["modules/15-execution-models-across-languages/assessment/calibration/manifests/repeat.json#identity and chronology","modules/15-execution-models-across-languages/assessment/calibration/repeat.md#Submission identity and chronology"]},{"id":"G02","passed":false,"evidence":["modules/15-execution-models-across-languages/assessment/calibration/repeat.md#Submission identity and chronology","modules/15-execution-models-across-languages/assessment/calibration/repeat.md#Failure and measurement evidence"]},{"id":"G03","passed":false,"evidence":["modules/15-execution-models-across-languages/assessment/calibration/repeat.md#Equivalent contract and four runtimes"]},{"id":"G04","passed":false,"evidence":["modules/15-execution-models-across-languages/assessment/calibration/repeat.md#Memory, scheduler, visibility, and boundary evidence"]},{"id":"G05","passed":false,"evidence":["modules/15-execution-models-across-languages/assessment/calibration/repeat.md#Failure and measurement evidence"]},{"id":"G06","passed":false,"evidence":["modules/15-execution-models-across-languages/assessment/calibration/repeat.md#Decision, defense, and Gate 5"]}],"rubric_scores":[{"criterion_id":"R01","score":0,"evidence":["modules/15-execution-models-across-languages/assessment/calibration/repeat.md#Equivalent contract and four runtimes"],"findings":["invariant_failure: Required work and limits differ because Java receives twice the memory and Go performs fewer children; Node also counts malformed responses as success. modules/15-execution-models-across-languages/assessment/calibration/repeat.md#Equivalent contract and four runtimes"],"remediation":["Return to Module 15 Lesson L06 and EX-10 for a new equivalence audit and four-runtime rerun."]},{"criterion_id":"R02","score":1,"evidence":["modules/15-execution-models-across-languages/assessment/calibration/repeat.md#Memory, scheduler, visibility, and boundary evidence","modules/15-execution-models-across-languages/assessment/calibration/repeat.md#Failure and measurement evidence"],"findings":["unsupported_claim: The claim that Rust has no leaks because it lacks tracing GC supplies vocabulary rather than owner, release, retention, and measured resource evidence. modules/15-execution-models-across-languages/assessment/calibration/repeat.md#Failure and measurement evidence","invariant_failure: An exception path leaves responses open. modules/15-execution-models-across-languages/assessment/calibration/repeat.md#Memory, scheduler, visibility, and boundary evidence"],"remediation":["Return to Module 15 Lesson L01 and EX-01\u201302 for a new owner/release map and bounded lifetime trial."]},{"criterion_id":"R03","score":0,"evidence":["modules/15-execution-models-across-languages/assessment/calibration/repeat.md#Memory, scheduler, visibility, and boundary evidence"],"findings":["invariant_failure: Offered work spawns before admission, so capacity is not bounded at the admission boundary. modules/15-execution-models-across-languages/assessment/calibration/repeat.md#Memory, scheduler, visibility, and boundary evidence"],"remediation":["Return to Module 15 Lesson L02 and EX-03\u201304 for a new placement map and queue telemetry trial."]},{"criterion_id":"R04","score":0,"evidence":["modules/15-execution-models-across-languages/assessment/calibration/repeat.md#Equivalent contract and four runtimes"],"findings":["invariant_failure: Node skips runtime validation and treats malformed responses as successful outcomes. modules/15-execution-models-across-languages/assessment/calibration/repeat.md#Equivalent contract and four runtimes"],"remediation":["Return to Module 15 Lesson L05 and EX-14\u201315 for a new negative validation fixture across all four runtimes."]},{"criterion_id":"R05","score":0,"evidence":["modules/15-execution-models-across-languages/assessment/calibration/repeat.md#Memory, scheduler, visibility, and boundary evidence"],"findings":["invariant_failure: Work spawns before admission and missing cancellation leaves child work active after the caller deadline. modules/15-execution-models-across-languages/assessment/calibration/repeat.md#Memory, scheduler, visibility, and boundary evidence"],"remediation":["Return to Module 15 Lesson L03 and EX-06\u201308 for a new isolated bounded-fan-out repair pair."]},{"criterion_id":"R06","score":0,"evidence":["modules/15-execution-models-across-languages/assessment/calibration/repeat.md#Memory, scheduler, visibility, and boundary evidence","modules/15-execution-models-across-languages/assessment/calibration/repeat.md#Failure and measurement evidence"],"findings":["invariant_failure: The repaired Go service still writes a shared map without synchronization. modules/15-execution-models-across-languages/assessment/calibration/repeat.md#Memory, scheduler, visibility, and boundary evidence","incorrect_reasoning: A clean sample is described as proof despite the surviving race. modules/15-execution-models-across-languages/assessment/calibration/repeat.md#Failure and measurement evidence"],"remediation":["Return to Module 15 Lesson L04 and EX-12\u201313 for a happens-before graph, tool run, and invariant oracle."]},{"criterion_id":"R07","score":0,"evidence":["modules/15-execution-models-across-languages/assessment/calibration/repeat.md#Memory, scheduler, visibility, and boundary evidence"],"findings":["invariant_failure: Child work remains active after the caller deadline and an exception path leaves responses open. modules/15-execution-models-across-languages/assessment/calibration/repeat.md#Memory, scheduler, visibility, and boundary evidence"],"remediation":["Return to Module 15 Lesson L03 and EX-08 for a new cancellation and exception trial demonstrating post-grace zero deltas."]},{"criterion_id":"R08","score":0,"evidence":["modules/15-execution-models-across-languages/assessment/calibration/repeat.md#Submission identity and chronology","modules/15-execution-models-across-languages/assessment/calibration/repeat.md#Failure and measurement evidence"],"findings":["invariant_failure: Predictions were edited after runtime results were known and raw F06/F07 output was replaced. modules/15-execution-models-across-languages/assessment/calibration/repeat.md#Submission identity and chronology","invariant_failure: Broken and repaired hashes differ, pairs change workload and multiple controls, and F06\u2013F08 repaired targets remain failed. modules/15-execution-models-across-languages/assessment/calibration/repeat.md#Failure and measurement evidence"],"remediation":["Return to Module 15 Lesson L06 and EX-17; preserve this attempt and repeat affected work with new seeds and a new frozen baseline."]},{"criterion_id":"R09","score":0,"evidence":["modules/15-execution-models-across-languages/assessment/calibration/repeat.md#Decision, defense, and Gate 5"],"findings":["missing_evidence: The runtime decision lacks security operations, migration, ownership, rollback, and reversal evidence. modules/15-execution-models-across-languages/assessment/calibration/repeat.md#Decision, defense, and Gate 5"],"remediation":["Return to Module 15 Lesson L08 and EX-18 for a separate ADR addendum and reviewed defense covering operations, owners, migration, rollback, and stops."]},{"criterion_id":"R10","score":0,"evidence":["modules/15-execution-models-across-languages/assessment/calibration/repeat.md#Decision, defense, and Gate 5"],"findings":["incorrect_reasoning: Rust is selected as universally fastest despite an incomplete build and unsafe evidence. modules/15-execution-models-across-languages/assessment/calibration/repeat.md#Decision, defense, and Gate 5","missing_evidence: Gate 5, reversal conditions, and a defensible bounded adoption path are absent. modules/15-execution-models-across-languages/assessment/calibration/repeat.md#Decision, defense, and Gate 5"],"remediation":["Return to Module 15 Lesson L08 and EX-18 for a new evidence-bound decision, defense, reversal conditions, and Gate 5 submission."]}],"average_score":0.1,"safety_critical_zero":true,"result":"Repeat","confidence":{"level":"high","reasons":["The fixture explicitly reports altered chronology, replaced raw evidence, non-equivalent work, a missing runtime, failed repaired invariants, a surviving race, orphan child work, and leaked responses.","The explicit failures directly match hard gates G02\u2013G05 and zero-level anchors for all safety-critical criteria R05\u2013R08."]},"summary":"Repeat is required: hard gates G02\u2013G05 fail, all safety-critical criteria R05\u2013R08 score zero, and the evidence also lacks complete identity, equivalent four-runtime execution, and a reversible owned decision.","next_actions":["Preserve the failed attempt unchanged and establish a new frozen baseline with new seeds before repeating affected work.","Rebuild equivalent four-runtime contract and matrix evidence with admission bounds, validation, synchronization, cancellation, cleanup, immutable raw records, and restored invariants.","Produce a separate owned and reversible ADR, reviewed defense, and Gate 5 submission after safe evidence is complete."]}
